{"schema_version":"1.0","analysis_run_id":"0198fd40-1111-7000-8000-000000000004","sample_sha256":"aaaaaaaaaaaaaaaaaaaaaaaaaaaaaaaaaaaaaaaaaaaaaaaaaaaaaaaaaaaaaaaa","platform":"android","created_at":"2026-08-08T12:00:00Z","producer":{"name":"android-erakshak","commit":"6462901d1aaa0b090b867934ea5a01a82d31bc03","mobsf_version":"4.5.1"},"native_contract":{"api_version":"v1","source_commit":"6462901d1aaa0b090b867934ea5a01a82d31bc03","static_report_endpoint":"/api/v1/report_json","dynamic_report_endpoint":"/api/v1/dynamic/report_json"},"analysis_window":{"started_at":"2026-08-08T12:00:00Z","ended_at":"2026-08-08T12:05:00Z"},"emulator":{"api_level":30,"avd_name":"fixture","guest_ip":"10.0.0.2"},"mobsf_reports":{"scan_hash":"11111111111111111111111111111111","static":{"kind":"mobsf_static_report","path":"mobsf/static.json","sha256":"cccccccccccccccccccccccccccccccccccccccccccccccccccccccccccccccc","size_bytes":1},"dynamic":null},"artifacts":[{"kind":"pcap","path":"network/capture.pcap","sha256":"bbbbbbbbbbbbbbbbbbbbbbbbbbbbbbbbbbbbbbbbbbbbbbbbbbbbbbbbbbbbbbbb","size_bytes":1}],"stimulation":{"actions":[]},"caveats":["network_responses_simulated"],"signature":{"key_id":"fixture","algorithm":"Ed25519","value":"sanitized"}}
